index,Unnamed: 0,title,tags,url,body,like,create_at
0,0,Elixir Evision と Nx で画像のコントラスト強調（ヒストグラム平坦化）を実装する,画像処理,https://qiita.com/RyoWakabayashi/items/bcd5d5940711e4480467,   はじめにバッチリメイクをしたはずなのに写真ではイマイチ印象に残らない そんなとき ありますよね  スクリーンショット       png  その問題 解決できますそう  Elixir ならねというわけでヒストグラム平均化で画像のコントラストを強調しますもちろん Elixir   Nx   Evision の組み合わせです当然のように Livebook で実行します実装の全量はこちら   実行環境Livebook    の Docker　イメージを元にしたコンテナで動かしましたコンテナ定義はこちらを参照   セットアップ必要なモジュールをインストールします  Req  元画像のダウンロード  Evision  画像処理  Kino  結果表示  Nx  行列演算実行自体に必要なのは Nx と Evision　だけです   画像のダウンロードいつものように Lenna さんを呼びます  スクリーンショット       png  これが元画像になります   グレースケールの場合まずは単純なグレースケールの場合について実装します画像をグレースケールに変換します  スクリーンショット       png  このグレーススケールの各ピクセルの値についてヒストグラムを作ってみますヒストグラムとは 値毎の件数をグラフ化したものです画像の場合    真っ白 から   真っ黒 の値がそれぞれ画像内に何回出現したか を表します例えば   灰色 近辺の件数が高く   や  近辺の件数が少ない   ヒストグラムが偏っている場合 画像全体が同じような灰色になっている ということなので コントラストが弱いと言えます逆に  から  まで満遍なく件数が同じくらいある   ヒストグラムが平坦になっている場合 真っ白な部分も真っ黒な部分も灰色の部分も同じくらいある ということになるのでコントラストが高いと言えますヒストグラムを見ると   あたりと  あたりの値が多いことが分かりますそして  や  の近辺は明らかに少ないですでは ヒストグラムを平坦にしてみましょう  スクリーンショット       png  画像がくっきりしたように見えます元画像と並べてみましょう  スクリーンショット       png  明らかにヒストグラム平坦化した方がくっきり コントラストが強くなっていますね平坦化した画像のヒストグラムを確認してみましょう完全な平坦ではないですが 元と比較すると凹凸が小さくなっています   カラーの場合カラーの場合は少し難しくなります Evision equalizeHist  はグレースケール チャネル数 色数 にしか使えませんかといって R G B それぞれについてヒストグラムを平坦化すると 色味が変わってしまいますなので 画像を BGR 色空間から HSV 色空間に変換します   note infoEvison OpenCV では RGB ではなく BGR を使っていますたまたま最近そのことについて記事を書いている方がいました OpenCV のピクセル形式が BGR である理由  BGR は青 Blue  緑 Green  赤 Red の頭文字で それぞれの原色がどれくらい強いかで色を表現しますHSV は色相 Hue  彩度 Saturation  明度 Value の頭文字で 色の種類 鮮やかさ 明るさの組み合わせで色を表現します色の種類や鮮やかさは変えずに明るさだけ変えたいので  HSV から V だけ取り出してヒストグラム平坦化してから  HS とくっ付ければいいわけです  スクリーンショット       png  HSV に変換しても画像を表示するときには BGR として表示しようとするため なんだかミステリアスな画像になっていますHSV から V を取り出すので  Nx の行列にしてから 　次元目の  列目を抜き出しますこの値は明るさだけを取り出しているので グレースケール画像のように表示できます  スクリーンショット       png  この V に対して  Evision equalizeHist  を実行します少し気をつけないといけないのは 次元数を下げてから実行し その後に戻すことです    次元数を下げる  縦  横        縦  横      次元数を上げる  縦  横      縦  横      スクリーンショット       png  この時点でコントラストが強調されたのが分かります最後に HS と V を結合します  スクリーンショット       png  カラーでもくっきりしています元画像と並べて見ましょう  スクリーンショット       png  明確にコントラストが強調されていますね   まとめVegaLite だとヒストグラムも簡単に作れるので 平坦化の概念が理解しやすかったです   参考サイト,4,2022-12-28
1,1,Elixir Evision と Nx で画像の明るさ調整（ガンマ補正）を実装する,画像処理,https://qiita.com/RyoWakabayashi/items/ab9857ddd79cbbcf6506,   はじめに画像が暗くて見づらい 印象が悪く見えてしまう そんなとき ありますよね  dark png  その問題 解決できますそう  Elixir ならねというわけでガンマ補正で画像の明るさを調整しますもちろん Elixir   Nx   Evision の組み合わせです当然のように Livebook で実行します実装の全量はこちら   実行環境Livebook    の Docker　イメージを元にしたコンテナで動かしましたコンテナ定義はこちらを参照   セットアップ必要なモジュールをインストールします  Req  元画像のダウンロード  Evision  画像処理  Kino  結果表示  Nx  行列演算実行自体に必要なのは Nx と Evision　だけです行列演算を見やすくしたいので Nx Defn をインポートしておきますこれで  defn  内で演算子による行列演算が記述できます   画像のダウンロードいつものように Lenna さんを呼びますこれが元画像になります  スクリーンショット       png     ガンマ補正ガンマ補正モジュールを以下のように定義します GammaCorrection correct  に画像と gamma パラメータを渡すことで明るさ補正ができますgamma    のとき明るくなります中身は後で解説しますでは実行してみましょう元画像とガンマ補正結果を並べてみます  スクリーンショット       png  明るくなりましたね次は   から   の範囲でガンマ補正をかけてみます  スクリーンショット       png  左上 gamma     から右下 gamma     に行くにつれて どんどん明るくなるのがわかると思います   演算内容の確認ガンマ補正で使っているテンソルの中身を見てみましょう  スクリーンショット       png  うーん これだけを見てもなんともですねgamma を変化させながらグラフにして見ましょうこのグラフの src が元の明るさ  dst が変換後の明るさと捉えてくださいgamma    のグラフを見ると  src が小さい値のときから dst の値がかなり大きくなっていますgamma    のときは src   dst ですgamma     のとき  src が  を越えないとほとんど dst が大きくなりません Evision lut  は Look Up Table という関数で テーブルを元に値を変換します変換例  src 変換元                 変換テーブル                  長さ                                     というように変換する  dst 変換後               なので  gamma    の変換テーブルを使えば小さい値 暗い色 でも大きい値 明るい値 に変換される結果 画像が明るくなります逆に gamma     の変換テーブルを使うと大きい値でも小さい値に変換されるため 画像が暗くなります   まとめ思った以上にガンマ補正がシンプルに実装できましたElixir だとやっぱり書くのが楽しいですね,4,2022-12-28
