index,Unnamed: 0,title,tags,url,body,like,create_at
114,114,全くの初心者が機械学習で雲の画像診断に挑戦したら,画像処理,https://qiita.com/kimiho-kori/items/209f8b56b333ba965b60,   はじめにはじめまして Qiita初投稿 エンジニア職を目指しAidemyで勉強中です 初めてのAIアプリを作ってみての自分なりの経験をまとめます 先に結果を言いますと非常にできの悪いアプリになったため 温かい目で感想 アドバイスなどあればよろしくお願いします    概要何のアプリを作ろうか何も考えてなく ぼーっと空を見ていてふと雲の画像識別を作ろうと考えました まず雲の種類は種類あるので それぞれの画像がどの雲に該当するかを判断するモデルを作る    流れ  まずは雲の写真を収集 種類枚前後   写真からそれぞれの種類の雲を分類  機械学習で雲の種類を学習させたモデルを作成  結果と反省 モデルの精度向上を目指して  まとめ言語はPython 環境はGoogle Colaboratoryを使用しました      まずは雲の写真を収集 種類枚前後 種類の雲は  巻積雲   巻層雲   巻雲   高積雲   高層雲   乱層雲   積乱雲   積雲   層積雲   層雲  という風に分かれています    巻積雲     巻積雲    巻層雲     巻層雲    巻雲     巻雲    高積雲    高積雲    高層雲   高層雲    乱層雲     乱層雲    積乱雲     積乱雲    積雲     積雲    層積雲     層積雲    層雲     層雲 画像を集める際にicrawlerという便利なPythonのパッケージを使いました icrawlerとはGoogle Bing Baidu Flickrなどの画像検索サービスから画像をダウンロードしてくれる便利なPythonのパッケージです使い方は下記のサイトを参考にしました 種類の雲をそれぞれスクレイピングしフォルダに格納しました      写真からそれぞれの種類の雲を分類画像を集めたものをチェックします まず関係ない画像やイラストもとってきてたのでそれ削除し スクレイピングしたものと違う雲の画像も多かったので正しいフォルダに画像を写す また つの画像に複数の種類の雲が写っていた場合は特定の種類の雲のみ切り取る ほぼ全ての画像に複数の種類の雲が写っていたので この作業だけでも一苦労でした      機械学習で雲の種類を学習させたモデルを作成インターネットから取得した画像は cvを用いて×にリサイズしてます 　まず最初にvggモデルを使えば それなりの精度のものが作れると思いモデルの作成を始めました VGGというのは  ImageNet と呼ばれる大規模画像データセットで学習された層からなるCNNモデルです ここに全結合層を再度学習させてみました しかし正答率が 強にしかならず 層を増やしてもあまり変わらず 転移学習を使わずにやってみるとこちらではおおよそ の正答率になったのでこちらでモデルを作ることにしました    正解率   訓練データは回あたりから右肩上がりだが 検証データに対してはずっと横ばい      反省 モデルの精度向上を目指して機械学習では データ集めや前処理が大切と言われている通り 作業の中でいちばん時間を割くことになりました 特に雲の場合枚枚千差万別で枚の画像の中に複数の雲が混じっていることなど当たり前で あまり良く撮れてない画像などもあり 目で見てもどの種類か判別に苦労しました また色や形など 半透明やしろ〜黒に近いグレー で見分けるにしても 朝方や夕方 日が落ちる直前などの画像は見た目でもほぼ判別不可能だったので学習する画像から排除したりして正答率が若干上がりました こちらのサイトでもわかるように変種や部分的な特徴もだいぶ被っているので振り分けるのに苦労しました 例えば  積雲 の一種の雄大積雲と 無毛の 積乱雲  いわゆる雷雲 の違いは雷があるかどうかだけなので画像で判別しようがないと思い 雄大積雲は積乱雲の方に入れました 一般の人にはどちらも入道雲と呼ばれている  その他も少しの大きさの違いや厚み 雲の高さなどで分かれるのでかなり大変でした 改良点ばかりなので まず考えられるのは 画像を増やす 集めたり 左右反転 水平移動 高いところの雲は回転させてもいいかも  空は 高層 中層 低層 に分かれているのでそれぞれの層別にモデルを作る  他の転移学習も試してみる 　　　　　　　　　　　　　　　　　　　　　　　　　　　　　　　　　　　　　　　　　　など   まとめ自分がこの数カ月で学んだことはわずかだと思います これからの課題は山ほどありますが とりあえず何かを作って行ったり 実践することが上達の近道だと思いますので 色々なアプリを作ったり kaggleやsignateへの挑戦 数学的 統計的な知識などを積極的に学んでいこうと思います 長く内容も薄いものになりましたが ここまで読んでくださりありがとうございました ,1,2022-07-26
115,115,オンライン会議いつも遅れる人をTeachable Machineで素早くつかまえてみた！,画像処理,https://qiita.com/natsupariri/items/9773c3f3238b6ebaa488,   出欠確認作業 これを楽に しかも早くしたい   私はこの確認作業で いつも時間に追われながら 一覧表を上に下にスクロールしています   人事部ではないけど 労務管理しています オンライン会議が普通になってはや数年 みなさんは 出欠確認はどのようにしていますでしょうか きっと私と同じように 入室していない人をあの  小さな画面で一人ずつ確認して 来ていない人に電話  をしているのではないでしょうか 電話をかけるにも まずは確認作業が必要ですよね デジタル化になっても  出欠確認はいつまでもアナログ     　時間がかかって困っています これって どうにかならないの と思い  画像判別  に挑戦しました 今回は いつも遅れる  しんのすけさん  を いち早くつかまえてみることにしました おや 上司の方は名前を見つけれず しんのすけさんに電話をかけたようです   画像学習③ jpg  いつもよく遅れるしんのすけさん今日は一番のりで間に合ったみたいですが すぐに名前を見つけてもらえなかったみたいですね    しんのすけさんの名誉のためにも 早く来た日は素早く確認できるようにしてみましょう    note今回の登場人物は フィクションですので 温かい目で見てください 笑   今回使用したもの  学習と検証比較対象として 今回はオレンジを学習しました   画像学習 jpg  検証すると 顔のアップや一部でも認識OKです   画像学習④ jpg  検証では しんのすけさんの認識OKです しんのすけさん あと少しです 待っててくださいね    ▽     noteここまでは 比較的順調に進めます 次に   Makeと連携させ LINEに結果を送ることができるかを検証  します   Makeでの設定  です LINEには   発見  検証結果     　というメッセージが送られてくるようにしました   画像学習⑤ jpg  比較対象のオレンジで検証をしました   画像学習⑦ jpg  　    note warn LINEとの連携はすぐにできましたが メッセージが届く時に　   検証結果の名前   　が来ず 　となって名前が出ず ここがかなり苦労しました   実装してみます それでは   LINEにメッセージが届くか  を検証します はい しっかりと結果が届き   しんのすけさんを素早くつかまえることに成功      ´艸｀ これで素早く見つけることができるようになりましたが 今後は早く入室してくださいね   まとめ今回は いつも遅れる一人を素早くつかまえるために ターゲットを絞りましたが 将来的には   参加者全員をあらかじめ学習しておき スプレッドシートに作成した名簿に入力して集計する   というところまでできたらいいなと考えています 夢は膨らむばかりです 画面をスクロールしながらの出欠確認は時間との闘いです 次の会議はこれを使い まずしんのすけさんを真っ先につかまえます 最後までお読みいただき ありがとうございました ,16,2022-07-25
116,116,EC2+Flask+AWS Rekognitionで画像処理を行う,画像処理,https://qiita.com/Yuma953/items/d2cb35afb0a56103f762,  画像に映っている人物の年齢と人数を取得する   AWS Rekognitionとは  AIを活用した画像認識サービス  APIのように簡単に利用可能  画像から様々な解析が可能   本記事では以下の方法については省略します  ecインスタンスの起動  nginx uwsgi flaskでのWEBサーバの構築   IAMロールを作成する  IAMのダッシュボードから ロール を選択   ロールを作成 を選択  以下の項目を選択して 次へ を選択      信頼されたエンティティタイプ AWSのサービス       一般的なユースケース EC   許可ポリシーで AmazonRekognitionFullAccess と検索しチェックを付けて 次へ を選択  任意のロール名を付けて ロールを作成 を選択   ECインスタンスにロールをアタッチする  ECダッシュボードから インスタンス を選択  AWS Rekognitionを使いたいインスタンスにチェックを付ける  アクションのセキュリティから IAMロールを変更 を選択  作成したIAMロールを選択する   flaskからAWSRekognitionに問い合わせる  EC上でbotoをインストールするpip install boto  年齢と人数情報を取得するプログラム      年齢取得            age   age      解析結果の平均を取得      人数取得  引用,0,2022-07-24
117,117,AI OCRが搭載された帳票電子化ツール AI JIMY Paperbotを使ってみた,画像処理,https://qiita.com/flskh/items/ebec1e7b4ce06ba2609f,  AI OCRについて調査    AI OCRとはOCRは 画像データのテキスト部分を認識し 文字データに変換する認識機能のことを言います 具体的には 紙文書をスキャナーで読み込み 書かれている文字を認識してデジタル化する技術です 人間は 紙に書かれている文字を無意識に理解しますが コンピューターは自動的に読み取ることが出来ません そのため 紙に書かれた文字をデジタルデータとして活用するには 一度 人間が読み取って文字に変換する必要があります これがデータ入力と呼ばれるものです しかし 単に文字を入力するという作業は非常に効率が悪く時間がかかります この作業を人間の代わりに行ってくれるのがOCRです AI OCRは OCRにAI技術を加えたものです AI技術を組み合わせることで 手書き文字も読めるようになりました     AI OCRの現状近年 中小企業では人手不足が深刻化しています そこでAI OCRを使用することでデータ入力の人件費を抑え 作業の効率を上げることが出来ます しかし 現状業績億未満の中小企業でのRPAの導入率は  そのうち AI OCRを導入しているのは と低い数字になっています その原因はコストがかかってしまう点であると考えます 従来の製品では文字を読み取る際に 読み取る項目ごとにコストがかかってしまい 項目数が多いほど料金が高くなります また AI OCRのみでは文字をデータ化することはできてもExcel等のアプリケーションに入力はできません データの入力までを行おうと思うと別途RPAツールや仕分けツールが必要になってしまいます   ツール選択背景出力したデータを他のアプリケーションに入力する際に別のツールが不要で つのツールで完結するものがないか探していました また 読み取り項目ごとに料金が加算されていくと コストがかかってしまう点が気になるポイントでした そこで見つけたのがAI JIMY Paperbotというツールでした  AI JIMY Paperbot公式サイト    AI JIMY PaperbotについてAI JIMY Paperbotはスキャンから文字認識 データ入力まで紙のデジタル化に必要な機能がすべて搭載されているとの事でした AI OCRのデメリットであったコスト面も 読み取る項目ごとではなく 帳票一枚単位のためコストを抑えることが出来ます また スキャンからデータ入力までの工程をつのツールで完結することができ 従来のAI OCR RPAツール 仕分けツールを組み合わせて使用するよりランニングコストも分の以下で運用可能です さらに AI JIMY Paperbotではリアルタイム処理やカメラと連動してスキャンをすることができます 既存製品のRPAとAI OCRを組み合わせた場合と AI JIMY Paperbotとの違いを表にまとめてみました      既存製品の組み合わせ   AI JIMY Paperbot    ツール数   RPA ＋仕分けツール   AI OCR   統合型    RPA   むずかしい   比較的簡単    リアルタイム処理   不向き   可能    スキャン機能   なし   カメラと連動可能    コスト   利用代金と導入開発費用   利用代金のみ      AI JIMY Paperbotの作成手順AI JIMY Paperbotのワークフローの作成手順は以下の通りです   取り込み スキャン   仕分け  文字認識  データ出力  RPA データ入力 それぞれの手順の詳しい説明はAI JIMY Paperbotの ナレッジベース  で確認することができました     AI JIMY Paperbotの認識率実際にAI JIMY Paperbotを使用して認識率を検証してみました その結果 印字された文字は  手書きの文字は という結果になりました 認識率は ではありませんが これはどの製品を使用しても になるのは難しいと感じました 例えば  いち やl エル の違いは前後の文脈から判断しなければなりません 手書き文字であるとなおさら区別が難しいです AI JIMY Paperbotでは認識結果を確認 修正できる設定があるため 読み取りを完全にAI OCR任せにするのではなく 人間が結果を確認すると良いと思います 人間が確認を行うと 自動化ではないと思うかもしれませんが 今までは手書き伝票を目で読みながら入力していました それに比べると 作業が認識結果の確認 修正だけになるため 大幅に業務の効率化を図れると思います    使ってみた感想    良かった点  ワークフローが簡単に作成できる 各項目の設定画面がわかりやすく プログラムを触ったことのない人でも作成することができると思いました RPAの部分もシンプルな作りで 組み立てるだけでシナリオが作成できます   データの入力可能 他の製品では別途ツールを導入しなければ入力を行えませんが AI JIMY Paperbotでは入力まで一つのツールで行うことができます RPAを使用することで条件式等も指定できるため 特定のデータだけを入力することも可能です   コスト削減 従来の製品に比べて項目ごとに課金するシステムではないため 読み取りたい項目が多い場合でもコストを抑えることができます また 別途ツールを導入する必要が無く 運用コストも従来の製品の分の以下にすることが可能です     良くなかった点 RPA機能というより転記機能でした CSVファイルを出力できるので 複雑な処理はPowerAutomateなどを使うのが良いと思います     使う際の注意点  チェックボックスモードの読み取り範囲 チェックボックスにチェックが入っているかの認識を行う際 チェックボックスの枠が読み取り範囲内に入ってしまうと結果がすべてtrueになってしまうため チェックボックスモードでの範囲設定は読み取り画像を拡大して設定するなどして枠が入らないように注意が必要です   認識結果の修正設定 認識結果をAI OCRにすべて任せるのではなく人間が確認 適宜修正を行うことでより確実にデータを読み取ることができます そのため 認識結果の修正を利用するに設定すると良いと思います    まとめAI JIMY Paperbotを使用することで紙文書のデータ化だけでなく データの入力まで行ってくれるため業務の効率化が図れると思いました 他の製品で入力まで行おうと思うと別途ツールが必要であったり コストがかかってしまったりとなかなか導入が難しいと感じました ですが AI JIMY Paperbotではつのツールでデータの入力まで完了する上 コストも抑えることができるため是非導入したいと思いました ,1,2022-07-22
118,118,DIS: Highly Accurate Dichotomous Image Segmentation やーる（Windows10、Python3.9）,画像処理,https://qiita.com/SatoshiGachiFujimoto/items/d6b150ae30126fd5e038,  はじめに画像セグメンテーションのDISやっていきまーす  開発環境  Windows PC  Python    Anaconda  導入． DIS  をクローンしますconda activate pygit clone cd DIS IS Net．requirements txtについては後で書くかもしれない U Netが動いていれば動くかも 行目行目hypar  mode      train hypar  mode      valid ．your dataset imにテストデータを置きます行目行目  実行U Netのテストデータを持ってきました 枚目の処理でGPUが足りないと怒られました  a 入力画像お疲れ様でした   参考文献,2,2022-07-21
119,119,【画像処理】PythonでOpenCVを使った色空間の変換,画像処理,https://qiita.com/spc_ehara/items/5c35d3c9900ad5e18e5c,PythonでOpenCVを使った色空間の変換今回は PythonでOpenCVを使った色空間の変換 を学んでいきます それぞれのバージョンはPython    OpenCV   になります また 今回の記事の内容はOpenCVの 公式ドキュメント  を参考にしています   OpenCVで色空間の変換処理OpenCVではcvtColorという色空間の変換処理を行う関数が実装されています 引数に変換前後の色空間を指定することで 様々な色空間への変換を行うことができます    python cvtColorcv cvtColor src  code   dst   dstCn    Parameters 説明  src 符号なしのビット or ビットまたはビット浮動小数点数 CV F の画像  code 色空間変換コード  dst srcと同じサイズと深さの画像  dstCn 出力画像のチャンネル数 の場合は元画像より自動的に算出     各チャンネルの扱いOpenCVでは各チャンネルをBGRの順で保持し 値は以下のつの型のどれかで表されます   型   範囲  ただし 最近は色空間の変換時にbitの画像がサポートされていない場合が多いため 実質CV UまたはCV Fのみとなります    変換時の注意点    非線形色空間への変換公式のドキュメントでは RGBからLuv等の非線形の色空間に変換する際は 正しい結果を得るためにcvtColorで変換する前に適切な値の範囲に正規化を自身で行う必要があると記載があります ただし 非線形色空間への変換時にbitまたはbitの画像が入力された場合は変換前に自動で適切な正規化が内部で行われるため 以下で紹介するように一部でも情報が失われると困る場合を除き 特に事前の正規化等は必要なさそうです     bit画像の変換通常 bit画像での変換では一部の情報が失われます もし 全範囲の色を必要とする場合や読み込み時に画像を変換して元に戻すような処理をする場合は bit画像を使用するほうが良いでしょう     アルファチャンネルを追加する変換変換によってアルファチャンネルが追加される場合 その値は対応するチャンネル範囲の最大値に設定されます CV Uの場合は CV Uの場合は CV Fの場合はとなります    色空間変換コードの種類についてOpenCVでは様々な色空間への変換ができるように以上の変換コードが実装されています ここではすべて紹介できないため 実装で使用する一部の変換コードとそれに対応する逆変換コードのみを以下に記載します   説明   色空間変換コード   色空間逆変換コード  OpenCVのすべての色空間変換コードは こちら  から確認できます また 変換に使用している数式に関しては こちら  から確認できます     実装実際の実装はこのようになります    入力画像   出力画像 BGR    入力画像  からグレースケールに変換するコード cv COLOR BGRGRAY を使用して グレースケール画像    出力画像  を取得することができました さらに 各変換コードを使用した結果を各チャンネルごとに以下に記載します     出力画像     出力画像     出力画像     出力画像      出力画像     出力画像     出力画像      出力画像     出力画像     出力画像      出力画像     出力画像     出力画像      出力画像     出力画像     出力画像      出力画像     出力画像     出力画像      出力画像     出力画像     出力画像      出力画像     出力画像     出力画像    色空間変換は可逆 不可逆 検証してみた色空間の変換後に逆変換を行い 変換前と逆変換後の画像を比較することで検証しました 画像同士の比較には numpyのarray equal  を使用し 差異があった場合はnumpyのisclose  を使用して その割合を算出しています bit画像とbit画像それぞれで検証に使用したスクリプトと結果をまとめた表を以下に記載します     bit画像の場合  色空間変換コード  色空間逆変換コード   差異の有無   異なるピクセルの割合   異なる値の平均幅         bit画像の場合  色空間変換コード  色空間逆変換コード   差異の有無   異なるピクセルの割合   異なる値の平均幅      異なる値の平均幅     bit bitどちらもBGRにアルファチャンネルを追加する変換のみ 変換前後の差異がありませんでした 既存のチャンネルに対しての操作が一切ないために差異が発生しなかったと考えられます それ以外の変換に関しては 少なからず差異が発生しているため 不可逆の変換だと言えます ただし bitのときとbitのときでは明らかに差異の大きさが異なりました 結果として 色空間の変換をする際にはbit bitどちらも基本的に不可逆だと考えて画像を扱うべきですが 多少の誤差を許容できる場合はbit画像での逆変換を行うことで誤差を最小限に抑えることが可能です   さいごに今回は  PythonでOpenCVを使った色空間の変換 について解説しました それでは引き続きよろしくお願いいたします 目次は以下の記事からご覧になれます ,15,2022-07-15
